name,utilisation,date_authorisation,composition,group_generic
"GABAPENTINE ARROW GENERIQUES 100 mg, gélule ","Classe pharmacothérapeutique :  autres analgésiques et antipyrétiques, gabapentinoïdes - code ATC :  N02BF01 GABAPENTINE ARROW GENERIQUES appartient à une classe de médicaments utilisés pour traiter l'épilepsie et les douleurs neuropathiques périphériques (douleurs persistantes causées par des lésions des nerfs). Le principe actif de GABAPENTINE ARROW GENERIQUES est la gabapentine. GABAPENTINE ARROW GENERIQUES est utilisé pour traiter : Votre médecin vous traitant vous-même ou votre enfant de 6 ans ou plus, prescrira GABAPENTINE ARROW GENERIQUES pour aider à traiter l’épilepsie lorsque votre traitement actuel ne permet pas de contrôler complètement la maladie. Vous ou votre enfant de 6 ans ou plus devez prendre GABAPENTINE ARROW GENERIQUES en association au traitement actuel, sauf indication contraire. GABAPENTINE ARROW GENERIQUES peut aussi être utilisé seul pour traiter les adultes et les enfants de plus de 12 ans ;",12/07/2011,['gabapentine'],"GABAPENTINE 100 mg – NEURONTIN 100 mg, gélule."
"GABAPENTINE ARROW 800 mg, comprimé pelliculé ","Classe pharmacothérapeutique : autres antiépileptiques - code ATC : N03AX12. GABAPENTINE ARROW 800 mg, comprimé pelliculé appartient à une classe de médicaments utilisés pour traiter l'épilepsie et les douleurs neuropathiques périphériques (douleurs persistantes causées par des lésions des nerfs). Le principe actif de GABAPENTINE ARROW 800 mg, comprimé pelliculé est la gabapentine.",24/04/2007,['gabapentine'],"GABAPENTINE 800 mg – NEURONTIN 800 mg, comprimé pelliculé."
"GABAPENTINE ARROW 600 mg, comprimé pelliculé ","Classe pharmacothérapeutique : autres antiépileptiques - code ATC : N03AX12. GABAPENTINE ARROW 600 mg, comprimé pelliculé appartient à une classe de médicaments utilisés pour traiter l'épilepsie et les douleurs neuropathiques périphériques (douleurs persistantes causées par des lésions des nerfs). Le principe actif de GABAPENTINE ARROW 600 mg, comprimé pelliculé est la gabapentine.",24/04/2007,['gabapentine'],"GABAPENTINE 600 mg – NEURONTIN 600 mg, comprimé pelliculé."
"HEMOCLAR 0,5 POUR CENT, crème ","Ce médicament est préconisé en traitement local d'appoint des traumatismes bénins (bleus, coups) chez l'adulte et l'enfant à partir d'un an.",05/01/1996,['pentosanne (polyester sulfurique de) sodique'],
"HEMLIBRA 30 mg/mL, solution injectable ",,23/02/2018,['émicizumab'],
"HEMLIBRA 150 mg/mL, solution injectable ",,23/02/2018,['émicizumab'],
"HEMIGOXINE NATIVELLE 0,125 mg, comprimé ","Classe pharmacothérapeutique - GLUOSIDE CARDIOTONIQUE code ATC : C01AA05 Ce médicament est un tonicardiaque, il augmente la force de contraction du muscle cardiaque. Il possède également des propriétés antiarythmiques (il régularise le rythme cardiaque). Ce médicament est préconisé dans:",10/04/1997,['digoxine'],"DIGOXINE 0,125 mg - HEMIGOXINE NATIVELLE 0,125 mg, comprimé"
"HEMI-DAONIL 2,5 mg, comprimé sécable ","Classe pharmacothérapeutique : HEMI-DAONIL 2,5 mg, comprimé sécable est un antidiabétique oral de la famille des sulfonylurées (médicaments qui font baisser le taux de sucre dans le sang, appelé glycémie). Indications thérapeutiques : Il est utilisé pour traiter un diabète non insulinodépendant (appelé également diabète de type 2 et ne nécessitant pas d’insuline), lorsqu’un régime n’a pas été suffisant pour rétablir à lui seul l’équilibre de votre glycémie.",18/12/1997,['glibenclamide'],"GLIBENCLAMIDE 2,5 mg - HEMI-DAONIL 2,5 mg, comprimé sécable."
"HEMGENIX 1 x 10 000 000 000 000 copies du génome/mL, solution à diluer pour perfusion ",,20/02/2023,['étranacogène dézaparvovec'],
"HEMATITE BOIRON, degré de dilution compris entre 2CH et 30CH ou entre 4DH et 60DH ",,17/12/2019,['hématite pour préparations homéopathiques'],
"HEMANGIOL 3,75 mg/ml, solution buvable ",,23/04/2014,['propranolol'],
"HEMAGENE TAILLEUR 200 mg, comprimé pelliculé ","Classe pharmacothérapeutique: AUTRE ANALGESIQUE ET ANTIPYRETIQUE. Code ATC: N02B. Ce médicament contient un anti-inflammatoire non stéroïdien: l'ibuprofène. Il est indiqué, chez l'adulte et l'enfant de plus de 20 kg (soit environ 6 ans), dans le traitement de courte durée de la fièvre et/ou des douleurs telles que maux de tête, états grippaux, douleurs dentaires, courbatures et règles douloureuses.",20/12/1995,['ibuprofène'],
"HELONIAS DIOICA LEHNING, degré de dilution compris entre 4CH et 30CH ou entre 8DH et 60DH ",,16/11/2017,['helonias dioica pour préparations homéopathiques'],
"HELONIAS DIOICA BOIRON, degré de dilution compris entre 3CH et 30CH ou entre 6DH et 60DH ",,30/08/2019,['helonias dioica pour préparations homéopathiques'],
HELONIAS COMPOSE BOIRON ,,07/08/2020,"['actaea racemosa pour préparations homéopathiques', 'aletris farinosa pour préparations homéopathiques', 'belladonna pour préparations homéopathiques', 'helonias dioica pour préparations homéopathiques', 'lilium tigrinum pour préparations homéopathiques', 'lonicera caprifolium pour préparations homéopathiques', 'sepia officinalis pour préparations homéopathiques']",
"HELMINTOX 250 mg, comprimé pelliculé ","Classe pharmacothérapeutique : ANTIHELMINTIQUE - code ATC : P02CC01. Ce médicament est un antiparasitaire. Il est préconisé dans le traitement de certaines parasitoses telles que l’ascaridiose, l’oxyurose et l’ankylostomiase.",21/03/1988,['pyrantel base'],
"HELMINTOX 125 mg/2,5 ml, suspension buvable ","Classe pharmacothérapeutique : ANTIHELMINTIQUE - code ATC : P02CC01. Ce médicament est un antiparasitaire. Il est préconisé dans le traitement de certaines parasitoses telles que l’ascaridiose, l’oxyurose et l’ankylostomiase.",21/03/1988,['pyrantel base'],"PYRANTEL (EMBONATE DE) équivalant à PYRANTEL 125 mg/2,5 ml - COMBANTRIN 125 mg/2,5 ml, suspension buvable."
"HELLEBORUS NIGER planta tota WELEDA, degré de dilution compris entre 3CH et 30CH ou entre 6DH et 60DH ",,22/11/2019,['helleborus niger planta tota pour préparations homéopathiques'],
"HELLEBORUS NIGER LEHNING, degré de dilution compris entre 3CH et 30CH ou entre 6DH et 60DH ",,01/08/2011,['helleborus niger pour préparations homéopathiques'],
"HELLEBORUS NIGER BOIRON, degré de dilution compris entre 3CH et 30CH ou entre 6DH et 60DH ",,01/08/2011,['helleborus niger pour préparations homéopathiques'],
"HELIKIT 75 mg, poudre pour solution buvable ",Classe pharmacothérapeutique : test respiratoire (test d’exploration fonctionnelle) à usage diagnostique et de contrôle - code ATC : V04CX05 Ce médicament est utilisé pour savoir si votre estomac a une infection par une bactérie appelée Helicobacter pylori . Votre médecin vous a recommandé de faire ce test pour les raisons suivantes : Ce médicament est réservé à l’adulte. Le test respiratoire doit être réalisé sous la supervision de professionnels de santé qualifiés et formés dans des établissements appropriés.,29/05/1997,"['urée [13C]', 'Pas de substance active.']",
"HELICOBACTER TEST INFAI, 75 mg poudre pour solution buvable ",,14/08/1997,['urée [13C]'],
"HELICOBACTER TEST INFAI pour les enfants agés de 3 à 11 ans, 45 mg, poudre pour solution buvable ",,10/10/2002,['urée [13C]'],
"HELICIDINE 10 POUR CENT SANS SUCRE, sirop édulcoré à la saccharine sodique et au maltitol liquide ",Classe pharmacothérapeutique - code ATC : ANTITUSSIF d'action périphérique. (R. Système respiratoire) Ce médicament est préconisé pour calmer les toux sèches et les toux d'irritation.,24/01/1996,['hélicidine'],
"HELIANTHUS ANNUUS BOIRON, degré de dilution compris entre 2CH et 30CH ou entre 4DH et 60DH ",,05/10/2011,['helianthus annuus pour préparations homéopathiques'],
"HEKLA LAVA BOIRON, degré de dilution compris entre 3CH et 30CH ou entre 6DH et 60DH ",,12/11/2020,['Hekla lava pour préparations homéopathiques'],
"HEDETUS, sirop ","Classe pharmacothérapeutique - code ATC : R05CA12 HEDETUS est un médicament à base de plantes utilisé comme expectorant en cas de toux productive. Il contient de l'extrait sec de feuille de lierre grimpant (Hedera helix L.). HEDETUS est indiqué chez l'adulte, l'adolescent et l'enfant de plus de 2 ans. Vous devez vous adresser à votre médecin si vous ne ressentez aucune amélioration ou si vous vous sentez moins bien après 5 jours.",20/06/2016,['extrait sec de feuille de lierre grimpant'],
"HEDERA HELIX LEHNING, degré de dilution compris entre 2CH et 30CH ou entre 4DH et 60DH ",,08/08/2013,['hedera helix pour préparations homéopathiques'],
"HEDERA HELIX BOIRON, degré de dilution compris entre 2CH et 30CH ou entre 4DH et 60DH ",,08/08/2013,['hedera helix pour préparations homéopathiques'],
"HEC, pommade pour application cutanée et nasale ",Classe pharmacothérapeutique : Autres préparations nasales (R : Système respiratoire) - code ATC : R01AX30 Dermatologie : Traitement local d’appoint des brûlures superficielles de faible étendue. Rhinologie : Traitement local d’appoint en cas de saignement de nez. Vous devez vous adresser à votre médecin si vous ne ressentez aucune amélioration ou si vous vous sentez moins bien après la fin du traitement.,08/12/1997,"['phénazone', 'acide tannique', ""extrait fluide d'hamamélis""]",
"HBVAXPRO 5 microgrammes, suspension injectable en seringue préremplie. Vaccin de l'hépatite B (ADNr) ",,27/04/2001,"[""antigène  de surface de l'hépatite B recombinant""]",
"HBVAXPRO 40 microgrammes, suspension injectable. Vaccin de l'hépatite B (ADNr) ",,27/04/2001,"[""antigène  de surface de l'hépatite B recombinant""]",
"HBVAXPRO 10 microgrammes, suspension injectable en seringue préremplie. Vaccin de l'hépatite B (ADNr) ",,27/04/2001,"[""antigène  de surface de l'hépatite B recombinant""]",
"HAVRIX NOURRISSONS ET ENFANTS 720 U/0,5 ml, suspension injectable en seringue préremplie. Vaccin de l'hépatite A (inactivé, adsorbé) ","Classe pharmacothérapeutique - code ATC : VACCIN CONTRE L’HEPATITE A (J : Anti-infectieux) Ce médicament est un vaccin. Ce médicament est préconisé dans la prévention de l’infection provoquée par le virus de l’hépatite A chez l’enfant à partir de l’âge de 1 an. L’hépatite A est une infection virale du foie. Lorsqu’un enfant reçoit ce vaccin, le système immunitaire (le système de défense naturelle de l’organisme) fabrique sa propre protection (anticorps) contre la maladie. Aucun des composants contenus dans le vaccin ne peut provoquer une hépatite A. La vaccination contre l’hépatite virale A est recommandée pour les sujets qui présentent un risque d’exposition au virus de l’hépatite A. Il ne protège pas contre les infections dues à d'autres types de virus de l'hépatite, ni d'autres agents pathogènes connus du foie. Ce vaccin doit être administré conformément aux recommandations officielles.",06/08/1998,"[""virus de l'hépatite A souche HM175 inactivé adsorbé""]",
"HAVRIX 1440 U/1 ml ADULTES, suspension injectable en seringue préremplie. Vaccin de l'hépatite A (inactivé, adsorbé) ","Classe pharmacothérapeutique - code ATC : VACCIN CONTRE L’HEPATITE A (J : Anti-infectieux) Ce médicament est un vaccin. Ce médicament est préconisé dans la prévention de l’infection provoquée par le virus de l’hépatite A chez l’adulte de plus de 15 ans. L’hépatite A est une infection virale du foie. Lorsqu’une personne reçoit ce vaccin, le système immunitaire (le système de défense naturelle de l’organisme) fabrique sa propre protection (anticorps) contre la maladie. Aucun des composants contenus dans le vaccin ne peut provoquer une hépatite A. La vaccination contre l'hépatite virale A est recommandée pour les sujets qui présentent un risque d’exposition au virus de l’hépatite A. Il ne protège pas contre les infections dues à d'autres types de virus de l'hépatite, ni d'autres agents pathogènes connus du foie. Ce vaccin doit être administré conformément aux recommandations officielles.",18/08/1994,"[""virus de l'hépatite A souche HM175 inactivé adsorbé""]",
"HAVLANE, comprimé sécable ","Classe pharmacothérapeutique : Hypnotiques et sédatifs - code ATC : N05CD Ce médicament est apparenté aux benzodiazépines. Ce médicament est indiqué dans le traitement de courte durée des symptômes de l'insomnie, chez l’adulte. Ce médicament vous a été prescrit parce que vous souffrez de troubles importants, gênants du sommeil entraînant une grande détresse.",10/07/1981,['loprazolam'],
"HARVONI 90 mg/400 mg, comprimé pelliculé ",,17/11/2014,"['lédipasvir', 'sofosbuvir']",
"HARPAGOPHYTUM LEHNING, degré de dilution compris entre 2CH et 30CH ou entre 4DH et 60DH ",,21/05/2013,['harpagophytum pour préparations homéopathiques'],
"HARPAGOPHYTUM BOIRON, degré de dilution compris entre 2CH et 30CH ou entre 4DH et 60DH ",,21/05/2013,['harpagophytum pour préparations homéopathiques'],
"HARMONET, comprimé enrobé ","Classe pharmacothérapeutique : PROGESTATIFS ET ESTROGENES EN ASSOCIATION FIXE - code ATC : G03AA10. HARMONET, comprimé enrobé est un contraceptif hormonal oral utilisé afin d’éviter une grossesse. Chaque comprimé de HARMONET, comprimé enrobé contient deux hormones féminines différentes en petite quantité : le gestodène et l’éthinylestradiol. Les contraceptifs oraux contenant deux hormones sont appelés contraceptifs oraux « combinés ».",01/06/1995,"['gestodène', 'éthinylestradiol']","GESTODENE 0,075 mg + ETHINYLESTRADIOL 0,020 mg - MELIANE, comprimé enrobé - HARMONET, comprimé enrobé."
"HAMAMELIS LEHNING, degré de dilution compris entre 2CH et 30CH ou entre 4DH et 60DH ",,21/05/2013,['hamamelis pour préparations homéopathiques'],
HAMAMELIS COMPOSE BOIRON ,,04/08/2020,"['hamamélis pour préparations homéopathiques', 'pulsatilla pour préparations homéopathiques', 'echinacea angustifolia pour préparations homéopathiques', 'fluoricum acidum pour préparations homéopathiques', 'viburnum prunifolium pour préparations homéopathiques', 'tussilago farfara pour préparations homéopathiques', 'corylus avellana pour préparations homéopathiques', 'aesculus hippocastanum pour préparations homéopathiques']",
"HAMAMELIS BOIRON, degré de dilution compris entre 2CH et 30CH ou entre 4DH et 60DH ",,21/05/2013,['hamamelis pour préparations homéopathiques'],
"HALDOL DECANOAS 50 mg/ml, solution injectable ","Le nom de votre médicament est HALDOL DECANOAS 50 mg/ml, solution injectable. HALDOL DECANOAS contient une substance active appelée halopéridol (sous forme de décanoate d’halopéridol). Il appartient à un groupe de médicaments appelés « antipsychotiques ». HALDOL DECANOAS est utilisé chez les adultes dont la maladie a été traitée précédemment par de l’halopéridol pris par voie orale. Il est utilisé pour traiter des maladies affectant les pensées, les sensations ou le comportement. Cela comprend des problèmes de santé mentale (tels que la schizophrénie). Ces maladies peuvent provoquer chez vous :",01/03/1983,['halopéridol'],
"HALDOL 5 mg/ml, solution injectable en ampoule ","Le nom de votre médicament est HALDOL 5 mg/ml, solution injectable en ampoule. HALDOL contient une substance active appelée halopéridol. Il appartient à un groupe de médicaments appelés « antipsychotiques ». HALDOL est utilisé chez les adultes pour traiter des maladies affectant les pensées, les sensations ou le comportement. Cela comprend des problèmes de santé mentale (tels que la schizophrénie et le trouble bipolaire) et des problèmes comportementaux. Ces maladies peuvent provoquer chez vous : HALDOL est également utilisé chez l’adulte : HALDOL peut être utilisé seul ou avec d’autres médicaments et il est parfois utilisé lorsque les autres médicaments ou traitements n’ont pas fonctionné, ont provoqué des effets indésirables inacceptables ou ne peuvent pas être utilisés par voie orale.",08/07/1994,['halopéridol'],
"HALDOL 5 mg, comprimé ","Le nom de votre médicament est HALDOL 5 mg, comprimé . HALDOL contient une substance active appelée halopéridol. Il appartient à un groupe de médicaments appelés « antipsychotiques ». HALDOL est utilisé chez les adultes, les adolescents et les enfants pour traiter des maladies affectant les pensées, les sensations ou le comportement. Cela comprend des problèmes de santé mentale (tels que la schizophrénie et le trouble bipolaire) et des problèmes comportementaux. Ces maladies peuvent provoquer chez vous : Chez les adolescents et les enfants, HALDOL est utilisé pour traiter la schizophrénie chez les patients âgés de 13 à 17 ans, et pour traiter les problèmes comportementaux chez les patients âgés de 6 à 17 ans. HALDOL est également utilisé : HALDOL est parfois utilisé lorsque les autres médicaments ou traitements n’ont pas fonctionné ou ont provoqué des effets indésirables inacceptables.",16/09/1986,['halopéridol'],
"HALDOL 2 mg/ml, solution buvable ","Le nom de votre médicament est HALDOL 2 mg/ml, solution buvable . HALDOL contient une substance active appelée halopéridol. Il appartient à un groupe de médicaments appelés « antipsychotiques ». HALDOL est utilisé chez les adultes, les adolescents et les enfants pour traiter des maladies affectant les pensées, les sensations ou le comportement. Cela comprend des problèmes de santé mentale (tels que la schizophrénie et le trouble bipolaire) et des problèmes comportementaux. Ces maladies peuvent provoquer chez vous : Chez les adolescents et les enfants, HALDOL est utilisé pour traiter la schizophrénie chez les patients âgés de 13 à 17 ans, et pour traiter les problèmes comportementaux chez les patients âgés de 6 à 17 ans. HALDOL est également utilisé : HALDOL est parfois utilisé lorsque les autres médicaments ou traitements n’ont pas fonctionné ou ont provoqué des effets indésirables inacceptables.",26/09/1990,['halopéridol'],
"HALDOL 1 mg, comprimé ","Le nom de votre médicament est HALDOL 1 mg, comprimé . HALDOL contient une substance active appelée halopéridol. Il appartient à un groupe de médicaments appelés « antipsychotiques ». HALDOL est utilisé chez les adultes, les adolescents et les enfants pour traiter des maladies affectant les pensées, les sensations ou le comportement. Cela comprend des problèmes de santé mentale (tels que la schizophrénie et le trouble bipolaire) et des problèmes comportementaux. Ces maladies peuvent provoquer chez vous : Chez les adolescents et les enfants, HALDOL est utilisé pour traiter la schizophrénie chez les patients âgés de 13 à 17 ans, et pour traiter les problèmes comportementaux chez les patients âgés de 6 à 17 ans. HALDOL est également utilisé : HALDOL est parfois utilisé lorsque les autres médicaments ou traitements n’ont pas fonctionné ou ont provoqué des effets indésirables inacceptables.",16/09/1986,['halopéridol'],
"HALAVEN 0,44 mg/ml, solution injectable ",,17/03/2011,['éribuline'],"ERIBULINE (MESILATE D') équivalan à ERIBULINE 0,44 mg/mL - HALAVEN 0,44 mg/ml, solution injectable"
"HAIMA 1000 mg, granulés enrobés en sachet ","Classe pharmacothérapeutique : Antifibrinolytiques - code ATC : B02AA02. HAIMA est utilisé pour la réduction des menstruations (règles) abondantes et ne doit être utilisé que si vos cycles sont réguliers, d’une durée de 21 à 35 jours avec une variabilité individuelle inférieure ou égale à 3 jours, et que vous avez plus de 15 ans. Il contient de l’acide tranexamique, qui empêche l’action de l’enzyme qui dissout les caillots sanguins. Cela diminue le volume et la durée des pertes sanguines.",09/11/2023,['acide tranexamique'],
"HAEMOPRESSIN 1 mg, poudre et solvant pour solution injectable ","Hormones systémiques, hormones sexuelles exclues, Hormones hypophysaires, hypothalamiques et analogues, Hormones de la post hypophyse, vasopressine et analogues - code ATC : H01BA04. HAEMOPRESSIN 1 mg, poudre et solvant pour solution injectable est une hormone pituitaire synthétique. HAEMOPRESSIN 1 mg, poudre et solvant pour solution injectable est utilisé dans le traitement des saignements des varices œsophagiennes (veines dilatées appelées aussi varices, situées au fond de l'œsophage).",04/08/2009,"['terlipressine', 'Pas de substance active.']",
"JUNIMIN, solution à diluer pour perfusion ","Classe pharmacothérapeutique - code ATC : solutions d’électrolytes, B05XA31 JUNIMIN est une solution à diluer pour perfusion. Elle contient cinq oligo-éléments (zinc, cuivre, manganèse, zinc, iode, sélénium) qui sont considérés comme essentiels car l’organisme ne peut les produire bien qu’il en ait besoin en très petites quantités pour pouvoir fonctionner correctement. Normalement, un régime alimentaire équilibré fourni ces oligo-éléments. JUNIMIN est utilisé comme source d’oligo-éléments chez les nouveau-nés prématurés et nés à terme, les nourrissons et les enfants qui ne peuvent pas être nourris normalement et nécessitent une nutrition par voie intraveineuse (dans une veine).",01/03/2017,"['gluconate de zinc', 'gluconate de cuivre', 'gluconate de manganèse', 'iodure de potassium', 'sélénite de sodium']",
"JUNALIZA 40 mg/10 mg, gélule ","Classe pharmacothérapeutique : hypolipidémiants ; hypolipidémiants en association code ATC : C10BA05 JUNALIZA contient deux substances actives différentes dans une gélule. L’une des substances actives est l’atorvastatine, appartenant au groupe des statines et l’autre substance active est l’ézétimibe. JUNALIZA est un médicament utilisé chez les adultes pour diminuer les taux de cholestérol total, de « mauvais » cholestérol (LDL-cholestérol) et de corps gras appelés triglycérides dans votre sang. De plus, il augmente également les taux de « bon » cholestérol (HDL-cholestérol). Ce médicament agit pour réduire votre cholestérol de deux manières : il réduit le cholestérol absorbé dans votre tube digestif, ainsi que le cholestérol fabriqué par votre corps. Pour la plupart des gens, un taux de cholestérol élevé n’a pas d’effet sur l’état général car il ne se manifeste par aucun symptôme. Cependant, s’il n’est pas traité, des dépôts graisseux peuvent s’accumuler dans les parois de vos vaisseaux sanguins ce qui entraîne leurs rétrécissements. Parfois, ces vaisseaux sanguins rétrécis peuvent se bloquer, ce qui peut interrompre l’apport de sang vers le cœur ou le cerveau, provoquant une crise cardiaque ou un accident vasculaire cérébral (AVC). En abaissant votre taux de cholestérol, vous pouvez réduire votre risque de développer une crise cardiaque, un accident vasculaire cérébral (AVC) ou des problèmes de santé apparentés. Ce médicament est utilisé chez les patients dont les taux de cholestérol ne peuvent être uniquement contrôlés par un régime hypocholestérolémiant. Vous devez poursuivre votre régime hypocholestérolémiant pendant le traitement avec ce médicament. Votre médecin peut vous prescrire JUNALIZA si vous prenez déjà de l’atorvastatine et de l’ézétimibe à la même posologie. Ce médicament ne vous aide pas à perdre du poids.",23/12/2022,"['atorvastatine', 'ézétimibe']",
"JUNALIZA 20 mg/10 mg, gélule ","Classe pharmacothérapeutique : hypolipidémiants ; hypolipidémiants en association code ATC : C10BA05 JUNALIZA contient deux substances actives différentes dans une gélule. L’une des substances actives est l’atorvastatine, appartenant au groupe des statines et l’autre substance active est l’ézétimibe. JUNALIZA est un médicament utilisé chez les adultes pour diminuer les taux de cholestérol total, de « mauvais » cholestérol (LDL-cholestérol) et de corps gras appelés triglycérides dans votre sang. De plus, il augmente également les taux de « bon » cholestérol (HDL-cholestérol). Ce médicament agit pour réduire votre cholestérol de deux manières : il réduit le cholestérol absorbé dans votre tube digestif, ainsi que le cholestérol fabriqué par votre corps. Pour la plupart des gens, un taux de cholestéro élevé l n’a pas d’effet sur l’état général car il ne se manifeste par aucun symptôme. Cependant, s’il n’est pas traité, des dépôts graisseux peuvent s’accumuler dans les parois de vos vaisseaux sanguins ce qui entraîne leurs rétrécissements. Parfois, ces vaisseaux sanguins rétrécis peuvent se bloquer, ce qui peut interrompre l’apport de sang vers le cœur ou le cerveau, provoquant une crise cardiaque ou un accident vasculaire cérébral (AVC). En abaissant votre taux de cholestérol, vous pouvez réduire votre risque de développer une crise cardiaque, un accident vasculaire cérébral (AVC) ou des problèmes de santé apparentés. Ce médicament est utilisé chez les patients dont les taux de cholestérol ne peuvent être uniquement contrôlés par un régime hypocholestérolémiant. Vous devez poursuivre votre régime hypocholestérolémiant pendant le traitement avec ce médicament. Votre médecin peut vous prescrire JUNALIZA si vous prenez déjà de l’atorvastatine et de l’ézétimibe à la même posologie. Ce médicament ne vous aide pas à perdre du poids.",23/12/2022,"['atorvastatine', 'ézétimibe']",
