name,utilisation,date_authorisation,composition,group_generic
"XEPLION 150 mg, suspension injectable à libération prolongée ",,04/03/2011,['palipéridone'],"PALIPERIDONE (PALMITATE DE) équivalent à PALIPERIDONE 150 mg - XEPLION 150 mg, suspension injectable à libération prolongée"
"XEPLION 100 mg, suspension injectable à libération prolongée ",,04/03/2011,['palipéridone'],"PALIPERIDONE (PALMITATE DE) équivalent à PALIPERIDONE 100 mg - XEPLION 100 mg, suspension injectable à libération prolongée"
"XEOMIN 50 unités, poudre pour solution injectable ","Classe pharmacothérapeutique : M03AX01 XEOMIN 50 unités, poudre pour solution injectable est un médicament qui contient comme principe actif la Neurotoxine Botulique de Type A qui détend les muscles injectés ou qui diminue le flux salivaire en fonction du site d’administration. XEOMIN 50 unités, poudre pour solution injectable est utilisé chez l'adulte pour le traitement :",25/11/2011,['toxine botulinique type A'],
"XEOMIN 200 unités, poudre pour solution injectable ","Classe pharmacothérapeutique : M03AX01 XEOMIN 200 unités, poudre pour solution injectable est un médicament qui contient comme principe actif la Neurotoxine Botulique de Type A qui détend les muscles injectés ou qui diminue le flux salivaire en fonction du site d’administration. XEOMIN 200 unités, poudre pour solution injectable est utilisé chez l'adulte pour le traitement :",22/06/2016,['toxine botulinique type A'],
"XEOMIN 100 unités, poudre pour solution injectable ","Classe pharmacothérapeutique : M03AX01 XEOMIN 100 unités, poudre pour solution injectable est un médicament qui contient comme principe actif la Neurotoxine Botulique de Type A qui détend les muscles injectés ou qui diminue le flux salivaire en fonction du site d’administration. XEOMIN 100 unités, poudre pour solution injectable est utilisé chez l’adulte pour le traitement :",08/01/2008,['toxine botulinique type A'],
"XENPOZYME 20 mg, poudre pour solution à diluer pour perfusion ",,24/06/2022,['olipudase alfa'],
"XENICAL 120 mg, gélule ",,29/07/1998,['orlistat'],"ORLISTAT 120 mg - XENICAL 120 mg, gélule"
"XENETIX 350 (350 mg d'Iode/mL), solution injectable ","Classe pharmacothérapeutique – Produits de contraste Iodés. Code ATC : V08AB11 Ces produits sont utilisés durant un examen radiologique. XENETIX 350 (350 mg d’Iode/mL), solution injectable  sert à renforcer le contraste des images obtenues lors de ces examens afin de mieux visualiser et délimiter les contours de certaines parties du corps. Ce médicament est à usage diagnostique uniquement. XENETIX 350 est utilisé pour plusieurs types d’examens radiographiques, dont :",24/08/1994,['iode'],
"XENETIX 300 (300 mg d'Iode/mL), solution injectable ","Classe pharmacothérapeutique – Produits de contraste Iodés. Code ATC : V08AB11 Ces produits sont utilisés durant un examen radiologique. XENETIX 300 (300 mg d’Iode/mL), solution injectable  sert à renforcer le contraste des images obtenues lors de ces examens afin de mieux visualiser et délimiter les contours de certaines parties du corps. Ce médicament est à usage diagnostique uniquement. XENETIX 300 est utilisé pour plusieurs types d’examens radiographiques, dont :",24/08/1994,['iode'],
"XENETIX 250 (250 mg d'iode/mL), solution injectable ","Classe pharmacothérapeutique – Produits de contraste Iodés. Code ATC : V08AB11 Ces produits sont utilisés durant un examen radiologique. XENETIX 250 (250 mg d’iode/mL), solution injectable  sert à renforcer le contraste des images obtenues lors de ces examens afin de mieux visualiser et délimiter les contours de certaines parties du corps. Ce médicament est à usage diagnostique uniquement.",24/08/1994,['iode'],
"XENAZINE 25 mg, comprimé sécable ",Classe pharmacothérapeutique : Autres médicaments en relation avec le système nerveux- code ATC : N07XX06 Ce médicament est indiqué :,28/07/2005,['tétrabénazine'],"TETRABENAZINE 25 mg - XENAZINE 25 mg, comprimé sécable."
"XEMBIFY 200 mg/mL, solution injectable sous-cutanée ","XEMBIFY est une solution d’immunoglobulines humaines (anticorps, essentiellement des immunoglobulines G) qui aident votre organisme à combattre les infections. XEMBIFY contient des immunoglobulines qui proviennent du plasma de donneurs sains. Les immunoglobulines aident à combattre les infections causées par des bactéries et des virus. Le médicament agit exactement de la même manière que les immunoglobulines produites par le système immunitaire et présentes naturellement dans le sang humain. XEMBIFY vous a été prescrit car votre taux d’immunoglobulines est anormalement bas en raison d’une affection appelée un déficit immunitaire. Les perfusions de XEMBIFY permettent d’augmenter les taux d’immunoglobulines (anticorps), en particulier les taux d’immunoglobulines G (IgG) de votre sang et de les ramener à des taux normaux. Ce médicament est indiqué chez les adultes, les enfants et les adolescents (de 0 à 18 ans) qui ne possèdent pas suffisamment d’anticorps (traitement substitutif) : 1. patients présentant un déficit immunitaire primitif (DIP), avec un manque d’anticorps existant dès la naissance ; 2. hypogammaglobulinémie (affection au cours de laquelle le taux d’immunoglobulines dans le sang est faible) et infections bactériennes à répétition chez des patients atteints de leucémie lymphoïde chronique (cancer du sang avec production excessive de globules blancs), pour lesquels les antibiotiques administrés à titre préventif n’ont pas été efficaces ; 3. hypogammaglobulinémie et infections bactériennes à répétition dans le myélome multiple (tumeur constituée de cellules dérivées de la moelle osseuse) ; 4. hypogammaglobulinémie chez les patients après une greffe de cellules souches provenant d’un donneur (allogreffe de cellules souches hématopoïétiques, GCSH allogénique).",17/12/2021,['immunoglobuline humaine normale (plasmatique)'],
"XELODA 500 mg, comprimé pelliculé ",,02/02/2001,['capécitabine'],"CAPÉCITABINE 500 mg - XELODA 500 mg, comprimé pelliculé"
"XELODA 150 mg, comprimé pelliculé ",,02/02/2001,['capécitabine'],"CAPÉCITABINE 150 mg - XELODA 150 mg, comprimé pelliculé"
"XELJANZ 5 mg, comprimé pelliculé ",,22/03/2017,['tofacitinib'],
"XELJANZ 11 mg, comprimé à libération prolongée ",,16/12/2019,['tofacitinib'],
"XELJANZ 10 mg, comprimé pelliculé ",,26/07/2018,['tofacitinib'],
"XELEVIA 50 mg, comprimé pelliculé ",,21/03/2007,['sitagliptine'],
"XELEVIA 100 mg, comprimé pelliculé ",,21/03/2007,['sitagliptine'],
"XATRAL LP 10 mg, comprimé à libération prolongée ",,22/08/2011,"[""chlorhydrate d'alfuzosine""]",
"XATRAL LP 10 mg, comprimé à libération prolongée ",,16/10/2012,"[""chlorhydrate d'alfuzosine""]",
"XATRAL LP 10 mg, comprimé à libération prolongée ","Classe pharmacothérapeutique - ALPHA-BLOQUANTS - code ATC : G04CA01 – G : système génito-urinaire et hormones sexuelles Xatral contient de l’alfuzosine. Ce médicament appartient à une famille appelée les alphas-bloquants. Ce médicament agit sur la vessie, l’urètre (conduit urinaire) et la prostate. Xatral est utilisé en cas d’augmentation du volume de votre prostate (hypertrophie bénigne de la prostate) : Ce médicament est destiné uniquement à l’homme.",30/11/1999,"[""chlorhydrate d'alfuzosine""]","ALFUZOSINE (CHLORHYDRATE D') 10 mg - XATRAL LP 10 mg, comprimé à libération prolongée."
"XATRAL 2,5 mg, comprimé pelliculé ","Classe pharmacothérapeutique - ALPHA-BLOQUANTS - code ATC : G04CA01 - G : système génito-urinaire et hormones sexuelles Xatral contient de l’alfuzosine. Ce médicament appartient à une famille appelée les alpha-bloquants. Ce médicament agit sur la vessie, l’urètre (conduit urinaire) et la prostate. Xatral est utilisé en cas d’augmentation du volume de votre prostate (hypertrophie bénigne de la prostate) pour soulager les difficultés à uriner. Ce médicament est destiné uniquement à l’homme.",12/11/1987,"[""alfuzosine (chlorhydrate d')""]",
"XARELTO 20 mg, comprimé pelliculé ",,09/12/2011,['rivaroxaban'],"RIVAROXABAN 20 mg - XARELTO 20 mg, comprimé pelliculé"
"XARELTO 2,5 mg, comprimé pelliculé ",,22/05/2013,['rivaroxaban'],"RIVAROXABAN 2,5 mg - XARELTO 2,5 mg, comprimé pelliculé"
"XARELTO 15 mg, comprimé pelliculé ",,09/12/2011,['rivaroxaban'],"RIVAROXABAN 15 mg - XARELTO 15 mg, comprimé pelliculé"
"XARELTO 15 mg + 20 mg, comprimé pelliculé ",,06/07/2016,['rivaroxaban'],"RIVAROXABAN 15 mg + 20 mg - XARELTO 15 mg + 20 mg, comprimé pelliculé"
"XARELTO 10 mg, comprimé pelliculé ",,30/09/2008,['rivaroxaban'],"RIVAROXABAN 10 mg - XARELTO 10 mg, comprimé pelliculé"
"XARELTO 1 mg/mL, granulés pour supension buvable ",,21/01/2021,['rivaroxaban'],
"XANAX 0,50 mg, comprimé sécable ","Classe pharmacothérapeutique : anxiolytique - code ATC : N05BA12. XANAX contient de l’alprazolam comme substance active . Ce médicament appartient à la classe des benzodiazépines (anxiolytiques) . XANAX est utilisé chez l’adulte dans le traitement des manifestations anxieuses sévères, handicapantes ou exposant l’individu à une détresse extrême . Ce médicament est utilisé uniquement pour les traitements de courte durée .",15/06/1982,['alprazolam'],"ALPRAZOLAM 0,50 mg - XANAX 0,50 mg, comprimé sécable."
"XANAX 0,25 mg, comprimé sécable ","Classe pharmacothérapeutique : anxiolytique - code ATC : N05BA12. XANAX contient de l’alprazolam comme substance active . Ce médicament appartient à la classe des benzodiazépines (anxiolytiques) . XANAX est utilisé chez l’adulte dans le traitement des manifestations anxieuses sévères, handicapantes ou exposant l’individu à une détresse extrême . Ce médicament est utilisé uniquement pour les traitements de courte durée.",15/06/1982,['alprazolam'],"ALPRAZOLAM 0,25 mg - XANAX 0,25 mg, comprimé sécable."
"XAMIOL 50 microgrammes/0,5 mg/g, gel ","Classe pharmacothérapeutique - code ATC : Anti-psoriasiques. Autres anti-psoriasiques pour usage topique, Calcipotriol, associations - D05AX52. XAMIOL est utilisé comme traitement topique du psoriasis du cuir chevelu chez les adultes. Le psoriasis est dû à une production trop rapide des cellules de votre peau. Ceci entraîne rougeur, desquamation et épaississement de la peau. XAMIOL contient du calcipotriol et de la bétaméthasone. Le calcipotriol aide à ramener la vitesse de croissance des cellules de la peau à la normale et la bétaméthasone agit en réduisant l'inflammation.",30/10/2008,"['calcipotriol', 'bétaméthasone']",
"XALUPRINE 20 mg/ml, suspension orale ",,09/03/2012,['mercaptopurine'],
"XALKORI 250 mg, gélule ",,23/10/2012,['crizotinib'],
"XALKORI 200 mg, gélule ",,23/10/2012,['crizotinib'],
"XALATAN 50 microgrammes/mL, collyre en solution ",XALATAN appartient à une famille de médicaments appelés analogues des prostaglandines. Il agit en augmentant le drainage du liquide intraoculaire vers le sang. XALATAN est indiqué chez les patients adultes atteints de glaucome à angle ouvert ou d’hypertension intraoculaire chez les adultes. Ces deux pathologies sont liées à une pression élevée à l’intérieur de l’œil (de vos yeux) risquant ainsi d’endommager votre vue. XALATAN est aussi utilisé chez les enfants et les bébés atteints d’hypertension intraoculaire ou de glaucome.,24/07/1997,['latanoprost'],"LATANOPROST 50 microgrammes/mL - XALATAN 50 microgrammes/mL, collyre en solution"
"XALACOM 50 microgrammes/mL + 5 mg/mL, collyre en solution ","Classe pharmacothérapeutique : Bêta-bloquant ophtalmique-timolol, en association. XALACOM contient deux principes actifs : le latanoprost et le timolol. Le latanoprost appartient à une famille de médicaments appelés analogues des prostaglandines. Le timolol appartient à une famille de médicaments appelés bêta-bloquants. Le latanoprost agit en augmentant la quantité de liquide évacué de l’œil. Le timolol agit en ralentissant la production de liquide dans l’œil. XALACOM est indiqué pour faire baisser la pression intraoculaire chez les patients atteints de glaucome à angle ouvert ou d’hypertonie intraoculaire. Ces deux pathologies sont liées à une augmentation de la pression à l’intérieur de l’œil qui risque éventuellement d’endommager la vue. Votre médecin prescrira XALACOM quand d’autres médicaments n’auront pas agi de manière adéquate.",11/09/2001,"['latanoprost', 'timolol base']","LATANOPROST 50 microgrammes/ml +  TIMOLOL (MALÉATE DE) équivalant à TIMOLOL 5 mg/ml - XALACOM 50 microgrammes/ml + 5 mg/ml, collyre en solution"
"XAGRID 0,5 mg, gélule ",,16/11/2004,['anagrélide'],"ANAGRELIDE (CHLORHYDRATE D') MONOHYDRATE  équivalant à ANAGRELIDE 0,5 mg - XAGRID 0,5 mg, gélule"
"XADAGO 50 mg, comprimé pelliculé ",,24/02/2015,['safinamide'],
"XADAGO 100 mg, comprimé pelliculé ",,24/02/2015,['safinamide'],
"X PREP, poudre orale en sachet ",Classe pharmacothérapeutique : Laxatifs stimulants - code ATC : A06AB06 Préparation du côlon en vue de lavements barytés ou de coloscopies et avant urographies intraveineuses.,03/10/1980,"['séné (feuille de), extrait sec titré de']",
"VALPROATE DE SODIUM TEVA SANTE L.P. 500 mg, comprimé pelliculé sécable à libération prolongée ",Classe pharmacothérapeutique : ANTIEPILEPTIQUE - code ATC : N03AG01 VALPROATE DE SODIUM TEVA SANTE L.P. appartient à une famille de médicaments appelés antiépileptiques. Ce médicament est utilisé pour le traitement des différentes formes d’épilepsie chez l’adulte et l’enfant âgé de plus de 6 ans et pesant plus de 17 kg.,09/08/2005,['valproate de sodium'],"VALPROATE DE SODIUM 500 mg - DEPAKINE CHRONO 500 mg, comprimé pelliculé sécable à libération prolongée."
"VALPROATE DE SODIUM SANDOZ L.P. 500 mg, comprimé pelliculé sécable à libération prolongée ","Classe pharmacothérapeutique : ANTIEPILEPTIQUE, code ATC : N03AG01. VALPROATE DE SODIUM SANDOZ L.P. appartient à une famille de médicaments appelés antiépileptiques. Ce médicament est utilisé pour le traitement des différentes formes d’épilepsie chez l’adulte et l’enfant âgé de plus de 6 ans et pesant 17 kg.",13/10/2009,"['valproate de sodium', 'acide valproïque']",
"VALPROATE DE SODIUM EG L.P. 500 mg, comprimé pelliculé sécable à libération prolongée ","Classe pharmacothérapeutique : ANTIEPILEPTIQUE, code ATC : N03AG01. VALPROATE DE SODIUM EG appartient à une famille de médicaments appelés antiépileptiques. Ce médicament est utilisé pour le traitement des différentes formes d’épilepsie chez l’adulte et l’enfant âgé de plus de 6 ans et pesant plus de 17 kg.",10/08/2005,['valproate de sodium'],"VALPROATE DE SODIUM 500 mg - DEPAKINE CHRONO 500 mg, comprimé pelliculé sécable à libération prolongée."
"VALPROATE DE SODIUM BIOGARAN L.P. 500 mg, comprimé pelliculé sécable à libération prolongée ","Classe pharmacothérapeutique : antiépileptiques, code ATC : N03AG01. Le valproate de sodium appartient à une famille de médicaments appelés antiépileptiques. Ce médicament est utilisé pour le traitement des différentes formes d’épilepsie chez l’adulte et l’enfant âgé de plus de 6 ans et pesant plus de 17 kg.",10/08/2005,['valproate de sodium'],"VALPROATE DE SODIUM 500 mg - DEPAKINE CHRONO 500 mg, comprimé pelliculé sécable à libération prolongée."
"VALPROATE DE SODIUM ARROW L.P. 500 mg, comprimé pelliculé sécable à libération prolongée ",Classe pharmacothérapeutique : antiépileptique - code ATC : N03AG01. VALPROATE DE SODIUM ARROW L.P. appartient à une famille de médicaments appelés antiépileptiques. Ce médicament est utilisé pour le traitement des différentes formes d’épilepsie chez l’adulte et l’enfant âgé de plus de 6 ans et pesant plus de 17 kg.,10/01/2006,['valproate de sodium'],"VALPROATE DE SODIUM 500 mg - DEPAKINE CHRONO 500 mg, comprimé pelliculé sécable à libération prolongée."
"VALPROATE DE SODIUM ARROW 200 mg/mL, solution buvable ","Classe pharmacothérapeutique : antiépileptique – code ATC : N03AG01 VALPROATE DE SODIUM ARROW appartient à une famille de médicaments appelés antiépileptiques. Ce médicament est utilisé pour le traitement des différentes formes d’épilepsie chez l’adulte et l’enfant. Chez l’enfant, il est également utilisé pour le traitement préventif des convulsions liées à la fièvre.",28/01/2011,['valproate de sodium'],"VALPROATE DE SODIUM 200 mg/ml - DEPAKINE 200 mg/ml, solution buvable"
"VALPROATE DE SODIUM AGUETTANT 400 mg/4 ml, solution injectable ","Classe pharmacothérapeutique : Antiépileptique - code ATC : N03AG01 Ce médicament est indiqué dans le traitement de divers types de convulsions, en relais de la forme orale lorsque celle-ci est temporairement inutilisable.",08/03/2007,['valproate de sodium'],
"VALIUM 10 mg/2 ml, solution injectable ","Classe pharmacothérapeutique : ANXIOLYTIQUE - code ATC : N05BA01 (N : système nerveux central) Ce médicament appartient à la classe des benzodiazépines. Ce médicament est préconisé dans les situations suivantes: Ce médicament peut être utilisé chez l'enfant et le nourrisson, par voie rectale, dans le traitement des convulsions dues à une forte fièvre.",22/10/1986,['diazépam'],"DIAZEPAM 10 mg/2 mL - VALIUM ROCHE 10 mg/2 ml, solution injectable"
"VALIUM 10 mg, comprimé sécable ","Classe pharmacothérapeutique ANXIOLYTIQUE - code ATC : N05BA01 (N: système nerveux central). Ce médicament appartient à la classe des benzodiazépines. Ce médicament est préconisé dans le traitement de l'anxiété lorsque celle-ci s'accompagne de troubles gênants, ou en prévention et/ou traitement des manifestations liées à un sevrage alcoolique.",22/10/1986,['diazépam'],"DIAZEPAM 10 mg -VALIUM ROCHE 10 mg, comprimé sécable."
"VALIUM 1 POUR CENT, solution buvable en gouttes ","Classe pharmacothérapeutique : ANXIOLYTIQUE - code ATC : N05BA01 (N : système nerveux central) Ce médicament appartient à la classe des benzodiazépines. Ce médicament est préconisé dans le traitement de l'anxiété lorsque celle-ci s'accompagne de troubles gênants, ou en prévention et/ou traitement des manifestations liées à un sevrage alcoolique. Il peut être prescrit chez votre enfant (moins de 5 ans) en prévention des récidives des convulsions liées à la fièvre, dans certaines conditions.",26/09/1988,['diazépam'],
"VALGANCICLOVIR ZENTIVA 450 mg, comprimé pelliculé ","Classe pharmacothérapeutique : antiviraux pour usage systémique, inhibiteurs nucléotides et nucléosides, inhibiteurs de la transcriptase inverse exclus, code ATC: J05AB14 VALGANCICLOVIR ZENTIVA appartient à un groupe de médicaments qui agissent directement pour empêcher la multiplication des virus. La substance active des comprimés, le valganciclovir, est transformée dans l'organisme en ganciclovir. Le ganciclovir empêche la multiplication d'un virus appelé cytomégalovirus (CMV) et l'invasion des cellules saines par celui-ci. Chez les patients dont le système immunitaire est affaibli, le CMV peut provoquer une infection des organes. Celle-ci peut mettre en danger la vie des patients. VALGANCICLOVIR ZENTIVA est utilisé :",28/09/2016,['valganciclovir'],"VALGANCICLOVIR (CHLORHYDRATE DE) équivalant à valganciclovir 450 mg - ROVALCYTE 450 mg, comprimé pelliculé"
"VALGANCICLOVIR VIATRIS 450 mg, comprimé pelliculé ","VALGANCICLOVIR VIATRIS contient la substance active valganciclovir (sous forme de chlorhydrate de valganciclovir). VALGANCICLOVIR VIATRIS appartient à un groupe de médicaments qui agissent directement pour empêcher la multiplication des virus. La substance active des comprimés, le valganciclovir, est transformée dans l’organisme en ganciclovir. Le ganciclovir empêche la multiplication d’un virus appelé cytomégalovirus (CMV) et l’invasion des cellules saines par celui-ci. Chez les patients dont le système immunitaire est affaibli, le CMV peut provoquer une infection des organes. Celle-ci peut mettre en danger la vie des patients.",28/05/2015,['valganciclovir'],"VALGANCICLOVIR (CHLORHYDRATE DE) équivalant à valganciclovir 450 mg - ROVALCYTE 450 mg, comprimé pelliculé"
"VALGANCICLOVIR TEVA 450 mg, comprimé pelliculé ","Classe pharmacothérapeutique : antiviraux à usage systémique, nucléosides et nucléotides, inhibiteurs de la transcriptase inverse exclus – code ATC : J05AB14 VALGANCICLOVIR TEVA appartient à un groupe de médicaments qui agissent directement pour empêcher la multiplication des virus. La substance active des comprimés, le valganciclovir, est transformée dans l'organisme en ganciclovir. Le ganciclovir empêche la multiplication d'un virus appelé cytomégalovirus (CMV) et l'invasion des cellules saines par celui-ci. Chez les patients dont le système immunitaire est affaibli, le CMV peut provoquer une infection des organes. Celle-ci peut mettre en danger la vie des patients. VALGANCICLOVIR TEVA est utilisé :",31/08/2016,['valganciclovir'],"VALGANCICLOVIR (CHLORHYDRATE DE) équivalant à valganciclovir 450 mg - ROVALCYTE 450 mg, comprimé pelliculé"
"VALGANCICLOVIR SANDOZ 450 mg, comprimé pelliculé ","VALGANCICLOVIR SANDOZ appartient à un groupe de médicaments qui agissent directement pour empêcher la multiplication des virus. La substance active des comprimés, le valganciclovir, est transformée dans l’organisme en ganciclovir. Le ganciclovir empêche la multiplication d’un virus appelé cytomégalovirus (CMV) et l’invasion des cellules saines par celui-ci. Chez les patients dont le système immunitaire est affaibli, le CMV peut provoquer une infection des organes. Celle-ci peut mettre en danger la vie des patients. VALGANCICLOVIR SANDOZ est utilisé :",20/06/2016,['valganciclovir'],"VALGANCICLOVIR (CHLORHYDRATE DE) équivalant à valganciclovir 450 mg - ROVALCYTE 450 mg, comprimé pelliculé"
"VALGANCICLOVIR EG 450 mg, comprimé pelliculé ","Classe pharmacothérapeutique - code ATC : J05AB14 VALGANCICLOVIR EG appartient à un groupe de médicaments qui agissent directement pour empêcher la multiplication des virus. La substance active des comprimés, le valganciclovir, est transformée dans l’organisme en ganciclovir. Le ganciclovir empêche la multiplication d’un virus appelé cytomégalovirus (CMV) et l’invasion des cellules saines par celui-ci. Chez les patients dont le système immunitaire est affaibli, le CMV peut provoquer une infection des organes. Celle-ci peut mettre en danger la vie des patients.",31/08/2016,['valganciclovir'],"VALGANCICLOVIR (CHLORHYDRATE DE) équivalant à valganciclovir 450 mg - ROVALCYTE 450 mg, comprimé pelliculé"
"VALGANCICLOVIR CRISTERS 450 mg, comprimé pelliculé ",,20/06/2016,['valganciclovir'],"VALGANCICLOVIR (CHLORHYDRATE DE) équivalant à valganciclovir 450 mg - ROVALCYTE 450 mg, comprimé pelliculé"
"VALGANCICLOVIR BIOGARAN 450 mg, comprimé pelliculé ","VALGANCICLOVIR BIOGARAN appartient à un groupe de médicaments qui agissent directement pour empêcher la multiplication des virus. La substance active des comprimés, le valganciclovir, est transformée dans l’organisme en ganciclovir. Le ganciclovir empêche la multiplication d’un virus appelé cytomégalovirus (CMV) et l’invasion des cellules saines par celui-ci. Chez les patients dont le système immunitaire est affaibli, le CMV peut provoquer une infection des organes. Celle-ci peut mettre en danger la vie des patients. VALGANCICLOVIR BIOGARAN est utilisé :",21/03/2017,['valganciclovir'],"VALGANCICLOVIR (CHLORHYDRATE DE) équivalant à valganciclovir 450 mg - ROVALCYTE 450 mg, comprimé pelliculé"
"VALGANCICLOVIR ARROW 450 mg, comprimé pelliculé ","Classe pharmacothérapeutique - code ATC : J05AB14. VALGANCICLOVIR ARROW appartient à un groupe de médicaments qui agissent directement pour empêcher la multiplication des virus. La substance active des comprimés, le valganciclovir, est transformée dans l’organisme en ganciclovir. Le ganciclovir empêche la multiplication d’un virus appelé cytomégalovirus (CMV) et l’invasion des cellules saines par celui-ci. Chez les patients dont le système immunitaire est affaibli, le CMV peut provoquer une infection des organes. Celle-ci peut mettre en danger la vie des patients.",26/08/2016,['valganciclovir'],"VALGANCICLOVIR (CHLORHYDRATE DE) équivalant à valganciclovir 450 mg - ROVALCYTE 450 mg, comprimé pelliculé"
"VALGANCICLOVIR ACCORD 450 mg, comprimé pelliculé ","VALGANCICLOVIR ACCORD appartient à un groupe de médicaments qui agissent directement pour empêcher la multiplication des virus. La substance active des comprimés, le valganciclovir, est transformée dans l’organisme en ganciclovir. Le ganciclovir empêche la multiplication d’un virus appelé cytomégalovirus (CMV) et l’invasion des cellules saines par celui-ci. Chez les patients dont le système immunitaire est affaibli, le CMV peut provoquer une infection des organes. Celle-ci peut mettre en danger la vie des patients. VALGANCICLOVIR ACCORD est utilisé :",28/09/2016,['valganciclovir'],"VALGANCICLOVIR (CHLORHYDRATE DE) équivalant à valganciclovir 450 mg - ROVALCYTE 450 mg, comprimé pelliculé"
"VALERIANA OFFICINALIS WELEDA, degré de dilution compris entre 2CH et 30CH ou entre 4DH et 60DH ",,19/09/2013,['valeriana officinalis pour préparations homéopathiques'],
"VALERIANA OFFICINALIS LEHNING, degré de dilution compris entre 2CH et 30CH ou entre 4DH et 60DH ",,19/09/2013,['valeriana officinalis pour préparations homéopathiques'],
"VALERIANA OFFICINALIS BOIRON, degré de dilution compris entre 2CH et 30CH ou entre 4DH et 60DH ",,20/09/2013,['valeriana officinalis pour préparations homéopathiques'],
